{
  "adapter_candidate_head": null,
  "adapter_candidate_worktree": null,
  "bootstrap_sha256": "27e05c0a637943f0fb0e8e8416183a4c8638c207cda6e748bcb558745694c709",
  "brainlehr_candidate_head": "640ceca7ae6f3aaa34d1a5072626639aa2b0e391",
  "brainlehr_candidate_worktree": null,
  "cache": {
    "first_divergence": null,
    "prompt_tokens": null,
    "re_prefilled_tokens": null,
    "reused_tokens": null
  },
  "db_mode": "FROZEN",
  "evidence": [],
  "gaps": [],
  "next_phase_path": "/Volumes/daten/Begod2026/brainlehr/docs/qwen_abschluss/00_BOOTSTRAP_OMLX_GRENZE.md",
  "open_must_ids": ["BDW-P60", "BDW-P67"],
  "phase_id": "00",
  "plan_schema_version": 1,
  "previous_verdict": "INITIAL",
  "push_status": "NOT_DONE",
  "requirements_sha256": "89e5b582384feb4f8c1a1c4c3a45f6103fa67aa835ee2c8519d117527e76187b",
  "retrieval": {
    "bge_m3": "ACTIVE",
    "coderank": "H0_INACTIVE",
    "rrf": "INACTIVE"
  },
  "startprompt_sha256": "1ef05369e6e0c3b98a0139069ba00c9352156988b80a72c520c4bde7703d7886"
}
